{
  "schema_version": 1,
  "name": "Frequent-items query modes",
  "metadata": {
    "kind": "FREQUENT_ITEMS",
    "wire_version": 1,
    "profile": "micro",
    "hash_domain": "prompt:v1",
    "hash_algo": "hmac_sha256_64",
    "representation_mode": "FREQUENT_ITEMS_BOUNDED_MAP",
    "frequent_items_map_size": 256
  },
  "operations": [
    {
      "op": "add_hash_weight",
      "hash_hex": "0000000000000010",
      "weight": 12
    },
    {
      "op": "add_hash_weight",
      "hash_hex": "0000000000000020",
      "weight": 3
    }
  ],
  "expected": {
    "estimate": 0,
    "body": {
      "total_weight": 15,
      "max_error": 0,
      "entries": [
        {
          "hash_hex": "0000000000000010",
          "estimate": 12,
          "error": 0,
          "lower_bound": 12,
          "upper_bound": 12
        },
        {
          "hash_hex": "0000000000000020",
          "estimate": 3,
          "error": 0,
          "lower_bound": 3,
          "upper_bound": 3
        }
      ],
      "no_false_negatives": [
        "0000000000000010",
        "0000000000000020"
      ],
      "no_false_positives": [
        "0000000000000010",
        "0000000000000020"
      ]
    }
  },
  "notes": "Query modes use max_error as the implicit threshold; with zero error both modes return all tracked entries by descending estimate."
}
