{
  "schema_version": 1,
  "name": "Cross-language MinHash merge",
  "metadata": {
    "hash_algo": "hmac_sha256_64",
    "hash_domain": "prompt:v1",
    "kind": "MINHASH",
    "minhash_signature_length": 64,
    "profile": "micro",
    "representation_mode": "MINHASH_SIGNATURE",
    "wire_version": 1
  },
  "operations": [],
  "expected": {
    "serialized_hex": "0a1d080410011a056d6963726f220970726f6d70743a763128013005c801406a85040a800416291e1ee42b6527f65c611ae59c0d0abda4d0511d89322288648564b13a70719aed11950d095c0f9d00b53d9165fd2a99cca2759c152d4ed1d378d43770125e095c4d89321b462af3d38e854cb2140336134e0eb9bd8d2be81fc2a83bbda01baa72a69bf781652bc39495d4b6ee65202de5daedb4e8402a1db29d23df741c2d19671fd133aa1d299eb7a6cfcd910c16560e9a3910f2455f7e36731aebe5ba13feef2be0d101840ad87b94b21b55b01ce284b9b82b3c6e4dc217caafe7cfe32c56c53e96d66e12195244e8c68eade5232ed342c0b81c541199b88afa8e2f8b0aa545c557bef94f04452c09f2386cf7abd60675b47c1435076ce766a619089948e8d9df3fc82f2f8ce79beed6a16e9c18dc95724956720b06b86ad87ac14e672a1e40c7555e540e15d26aa5847bd7f7448dd2e4030ca575252ce2e143f9f0512cd27a25ff64be2f0e3a1322eb8beb6d29e9b44faf235f8508add3526218aac425fbff46a115128429dfb72e96c7de56151dbcd6254b1a9650ea1f4f5a2f7348407ce1ff133958633ff8c6621de490d3266480bd828b346a61a1360a7500382c240c714274851e362723021fbe3e49a81786bf82814ed304211cb1d40a4693d930171ef0aa815952a73b7b0d12701abd2d9547ef70fda5f024451b72fa5abfa078b339735245e20e1f754fb1514766e2018079108df4f8f7950e3f47f75a2aba4a1004",
    "body": {
      "merged_serialized_hex": "0a1d080410011a056d6963726f220970726f6d70743a763128013005c801406a85040a800416291e1ee42b6527f65c611ae59c0d0abda4d0511d89322288648564b13a70719aed11950d095c0f9d00b53d9165fd2a99cca2759c152d4ed1d378d43770125e095c4d89321b462af3d38e854cb2140336134e0eb9bd8d2be81fc2a83bbda01baa72a69bf781652bc39495d4b6ee65202de5daedb4e8402a1db29d23df741c2d19671fd133aa1d299eb7a6cfcd910c16560e9a3910f2455f7e36731aebe5ba13feef2be0d101840ad87b94b21b55b01ce284b9b82b3c6e4dc217caafe7cfe32c56c53e96d66e12195244e8c68eade5232ed342c0b81c541199b88afa8e2f8b0aa545c557bef94f04452c09f2386cf7abd60675b47c1435076ce766a619089948e8d9df3fc82f2f8ce79beed6a16e9c18dc95724956720b06b86ad87ac14e672a1e40c7555e540e15d26aa5847bd7f7448dd2e4030ca575252ce2e143f9f0512cd27a25ff64be2f0e3a1322eb8beb6d29e9b44faf235f8508add3526218aac425fbff46a115128429dfb72e96c7de56151dbcd6254b1a9650ea1f4f5a2f7348407ce1ff133958633ff8c6621de490d3266480bd828b346a61a1360a7500382c240c714274851e362723021fbe3e49a81786bf82814ed304211cb1d40a4693d930171ef0aa815952a73b7b0d12701abd2d9547ef70fda5f024451b72fa5abfa078b339735245e20e1f754fb1514766e2018079108df4f8f7950e3f47f75a2aba4a1004",
      "populated_count": 4,
      "source_serialized_hex": {
        "left": "0a1d080410011a056d6963726f220970726f6d70743a763128013005c801406a85040a800458b04de7340fad5df65c611ae59c0d0abda4d0511d89322288648564b13a70719aed11950d095c0f8aa0ef8d877725aad7557903514cc9a4d1d378d43770125e095c4d89321b462af3d38e854cb2140336134e0eb9bd8d2b2feaa9a1fd343c56571e200fd5f40479c39495d4b6ee65202de5daedb4e8402ad84d5887d25cff31354d9a3bb4b5c452b15b1ef0c06b2f84560e9a3910f2455f7e36731aebe5ba13feef2be0d101840ad87b94b21b55b01ce284b9b82b3c6e4d368b14c84bc48d6e56c53e96d66e12195244e8c68eade5232ed342c0b81c54118fce652fe709a070a545c557bef94f04cadafc573c3090add60675b47c1435076ce766a619089948e8d9df3fc82f2f8c535f209113b0b0b1dc95724956720b06b86ad87ac14e672afa7dbac75e57c9bfd26aa5847bd7f74499288c47e664fe578f25c01b5005ea7421e144df805eb290e9179d7c8951c170e9b44faf235f8508add3526218aac425fbff46a11512842901c9ae6679c89a27f5b15f410fd08555ea1f4f5a2f7348407ce1ff133958633ff8c6621de490d3266480bd828b346a61bdad5a18cec4764c3567cb91effba933907f89fac7e1df291011f68cc6f3f869e390ed5905df5c67f029d3a43b7122b8ee904788b8b4be3cb0ba2ffff9a6eb8188e9bb3d68bd50b902e6782bda6652b70ec0075579b53f4a7ff4c545d51952a207005e6824af94a01002",
        "right": "0a1d080410011a056d6963726f220970726f6d70743a763128013005c801406a85040a800416291e1ee42b6527b100c105c412b592efea5084f45afd46ef2551f35ff3a0afaa1b3ca7869d5a249d00b53d9165fd2a99cca2759c152d4ea77f9e3f7b8f4f782ce00b5b4dfba1b95ef8321a0a5e955a9ec674bb14bd0445e81fc2a83bbda01baa72a69bf781652bd620be346484a220ab17ef2c06123b3b1db29d23df741c2d19671fd133aa1d299eb7a6cfcd910c16ebcf1a28dcf25465d1559d418b75255ce28e4b3246d2023b3fea47eb00e3af80fbaed22018a17ad8c217caafe7cfe32cc442f7e52e4467d63e6aebd7754785665f639f4f6a74c55999b88afa8e2f8b0af97267086edb753e452c09f2386cf7ab51859569b16c67498b8582150011d952a28914003ce7b5a7e79beed6a16e9c18d1d7dc481fc2796ff944226d5ca878411e40c7555e540e15c7e70565353694528dd2e4030ca575252ce2e143f9f0512cd27a25ff64be2f0e3a1322eb8beb6d2984046e2aef4ebc393ba6c27a3fe47e6791373067cdef1b74dfb72e96c7de56151dbcd6254b1a96500f392dfcf03952952167e4db2923529612607383a630de53b0038c375a59436ea1360a7500382c240c714274851e362723021fbe3e49a81786bf82814ed304211cb1d40a4693d930171ef0aa815952a73b7b0d12701abd2d9547ef70fda5f024451b72fa5abfa078b339735245e20e1f754fb1514766e2018079108df4f8f7950e3f47f75a2aba4a1002"
      }
    }
  },
  "notes": "Go-origin MinHash fixtures cover cross-language element-wise minimum merge."
}
