{
  "schema_version": 1,
  "name": "Empty HLL++ small sparse",
  "metadata": {
    "kind": "HLLPP",
    "wire_version": 1,
    "profile": "small",
    "hash_domain": "prompt:v1",
    "hash_algo": "hmac_sha256_64",
    "representation_mode": "HLLPP_SPARSE",
    "hllpp_normal_precision": 14,
    "hllpp_sparse_precision": 18
  },
  "operations": [],
  "expected": {
    "estimate": 0,
    "body": {
      "sparse_registers": []
    }
  }
}
