{
  "schema_version": 1,
  "name": "Bloom OR merge",
  "metadata": {
    "kind": "BLOOM",
    "wire_version": 1,
    "profile": "micro",
    "hash_domain": "prompt:v1",
    "hash_algo": "hmac_sha256_64",
    "representation_mode": "BLOOM_BITSET",
    "bloom_bit_count": 143776,
    "bloom_hash_count": 10
  },
  "operations": [
    {
      "op": "add_hash",
      "hash_hex": "0000000000000001",
      "source": "left"
    },
    {
      "op": "add_hash",
      "hash_hex": "0000000000000002",
      "source": "left"
    },
    {
      "op": "add_hash",
      "hash_hex": "0000000000000003",
      "source": "right"
    },
    {
      "op": "add_hash",
      "hash_hex": "0000000000000004",
      "source": "right"
    }
  ],
  "expected": {
    "body": {
      "inserted_count": 4,
      "set_bits": [
        1012,
        7991,
        10841,
        16383,
        19742,
        26145,
        34106,
        36173,
        38230,
        43263,
        44396,
        44536,
        46460,
        47457,
        50840,
        55051,
        58200,
        59169,
        59213,
        61180,
        67313,
        70386,
        76514,
        80068,
        98992,
        99885,
        102092,
        103012,
        104220,
        105515,
        108155,
        116542,
        120365,
        123841,
        124193,
        124244,
        126433,
        135242,
        136666,
        142967
      ],
      "may_contain": [
        "0000000000000001",
        "0000000000000002",
        "0000000000000003",
        "0000000000000004"
      ],
      "may_not_contain": [
        "deadbeefcafebabe"
      ],
      "false_positive_estimate": 2.7741620835516896e-36
    }
  },
  "notes": "Operations are source-partitioned and merged with bitwise OR under identical metadata."
}
