{
  "schema_version": 1,
  "name": "Frequent-items source merge",
  "metadata": {
    "kind": "FREQUENT_ITEMS",
    "wire_version": 1,
    "profile": "micro",
    "hash_domain": "prompt:v1",
    "hash_algo": "hmac_sha256_64",
    "representation_mode": "FREQUENT_ITEMS_BOUNDED_MAP",
    "frequent_items_map_size": 256
  },
  "operations": [
    {
      "op": "add_hash_weight",
      "hash_hex": "0000000000000010",
      "weight": 10,
      "source": "left"
    },
    {
      "op": "add_hash_weight",
      "hash_hex": "0000000000000020",
      "weight": 2,
      "source": "left"
    },
    {
      "op": "add_hash_weight",
      "hash_hex": "0000000000000010",
      "weight": 4,
      "source": "right"
    },
    {
      "op": "add_hash_weight",
      "hash_hex": "0000000000000030",
      "weight": 9,
      "source": "right"
    }
  ],
  "expected": {
    "estimate": 0,
    "body": {
      "total_weight": 25,
      "max_error": 0,
      "entries": [
        {
          "hash_hex": "0000000000000010",
          "estimate": 14,
          "error": 0,
          "lower_bound": 14,
          "upper_bound": 14
        },
        {
          "hash_hex": "0000000000000020",
          "estimate": 2,
          "error": 0,
          "lower_bound": 2,
          "upper_bound": 2
        },
        {
          "hash_hex": "0000000000000030",
          "estimate": 9,
          "error": 0,
          "lower_bound": 9,
          "upper_bound": 9
        }
      ]
    }
  },
  "notes": "Operations are partitioned by source and merged under identical profile/hash metadata."
}
